{"schemaVersion":"CapabilityGateTransitionEvidence 0.1","capability":"scheduler-supervisor","action":"promote","planHash":"9a7c301b65e17668423722b32f15fd0d6ef23b3a260dcd840fc183dfc6d605c6","beforeStateHash":"c61c4176086b86abb0f718ef81618d668828c0293144b65822383e8bfb4b76e0","afterStateHash":"df4ad10bdc00931e4f6d53f7caa364a984aea502b71744f9bf8db4c82d0ea685","details":{},"evidence":["all five Scheduler Supervisor Gates passed","Agent Ops run 31723369081","explicit GitOps promotion review"],"evidencePath":"ops/evidence/capability-gates/scheduler-supervisor/promote-promote-9a7c301b65e17668.json"}