{"schemaVersion":"CapabilityGateTransitionEvidence 0.1","capability":"continuation-state","action":"pass","planHash":"4b35549b8a9d85b8072d039a42e525fa10b649a3572076f0b7631db2c738755c","beforeStateHash":"b6b0a7f2c618ed4a12f54ec211aa50d7c563da849d2b6c31d0cbbe351181e82e","afterStateHash":"b27f1bf061e96fbc984754693ccb517ddb118b677499461c68e0e994feae8cfb","details":{"gateId":"rollback"},"evidence":["tools/tests/test_continuation_rollback.py","Agent Ops run 31721541661"],"evidencePath":"ops/evidence/capability-gates/continuation-state/pass-rollback-4b35549b8a9d85b8.json"}
