{"schemaVersion":"CapabilityGateTransitionEvidence 0.1","capability":"scheduler-supervisor","action":"pass","planHash":"b67d878f166e8913db92ef7645f67afe3aeb5a2eb3b0071abacf05fa40472067","beforeStateHash":"cf828b64d95b20c310f00efbbecddfcdb1808b213453071d59faa798114e0da3","afterStateHash":"8f9397691b193d029a495ed4da82eda7dce8e5011a235bfe825fd3140f3f525b","details":{"gateId":"rollback"},"evidence":["Agent Ops run 31723369081","tools/tests/test_scheduler_rollback.py"],"evidencePath":"ops/evidence/capability-gates/scheduler-supervisor/pass-rollback-b67d878f166e8913.json"}