{"schemaVersion":"CapabilityGateTransitionEvidence 0.1","capability":"scheduler-supervisor","action":"pass","planHash":"15a45c5cb1a854d8f6148565c7b2fda8165c04d618e5b070e2e65a9591334bbd","beforeStateHash":"f189206fcfbd6bf52d687e4ae391c544aec4c971c19b0f7547451de697da5255","afterStateHash":"a0cb779ace6ef29b1d32e9601b8db6cdbab1ff303b072cca5df6c08f6e3215a8","details":{"gateId":"rollback"},"evidence":["Agent Ops run 31723369081","tools/tests/test_scheduler_rollback.py"],"evidencePath":"ops/evidence/capability-gates/scheduler-supervisor/pass-rollback-15a45c5cb1a854d8.json"}