{"schemaVersion":"CapabilityGateTransitionEvidence 0.1","capability":"scheduler-supervisor","action":"pass","planHash":"11e627e9f3f23501344c80191c4741fb104589c892ed6ebea67952c374c89c46","beforeStateHash":"5cd7caec058ba537ec8b69d3aad6991adbd251a90f7d7d53540ed03370c61c14","afterStateHash":"c61c4176086b86abb0f718ef81618d668828c0293144b65822383e8bfb4b76e0","details":{"gateId":"transport-boundary"},"evidence":["Agent Ops run 31723369081","scheduler-plan-probe artifact 9190251732","readOnly=true; transportSideEffects=false; semanticAuthority=false"],"evidencePath":"ops/evidence/capability-gates/scheduler-supervisor/pass-transport-boundary-11e627e9f3f23501.json"}