{"schemaVersion":"CapabilityGateTransitionEvidence 0.1","capability":"scheduler-supervisor","action":"pass","planHash":"196bb6038105ff505b7f5502e6e55df8edb8d8693447c53ccaf8e0572c0e7e79","beforeStateHash":"3a2d98a264a10b2f33b229cc5b2873c6b8dd87b19fd4e8990d84413c3b6223e6","afterStateHash":"cf828b64d95b20c310f00efbbecddfcdb1808b213453071d59faa798114e0da3","details":{"gateId":"non-actionable-no-wake"},"evidence":["Agent Ops run 31723369081","tools/tests/test_scheduler_plan.py::test_non_actionable_routing"],"evidencePath":"ops/evidence/capability-gates/scheduler-supervisor/pass-non-actionable-no-wake-196bb6038105ff50.json"}