{"schemaVersion":"CapabilityGateTransitionEvidence 0.1","capability":"scheduler-supervisor","action":"pass","planHash":"ddead649622f614e27042dec58f9f29c78ff42dbc6e5f5c8c961375c0366b00f","beforeStateHash":"ba36772de31ea8d2b4c2e7b6af1712f509334435a5dd327b9a77ca9798d97c82","afterStateHash":"3a2d98a264a10b2f33b229cc5b2873c6b8dd87b19fd4e8990d84413c3b6223e6","details":{"gateId":"inspection-integrity"},"evidence":["Agent Ops run 31723369081","tools/tests/test_scheduler_plan.py::test_rejects_tampered_inspection","scheduler-plan-probe artifact 9190251732"],"evidencePath":"ops/evidence/capability-gates/scheduler-supervisor/pass-inspection-integrity-ddead649622f614e.json"}