{"schemaVersion":"CapabilityGateTransitionEvidence 0.1","capability":"scheduler-supervisor","action":"pass","planHash":"1524a11c43f0f0241725a432e124aee89a1c295912ec0a58278fa242b5223750","beforeStateHash":"c227810119f357abe5768cae2bd80b531489861465651616176b85ac80d6b519","afterStateHash":"6ab47b7618154cbdbf11f3d1ea20c14a1042f714572e415e8afc3d761749109a","details":{"gateId":"transport-boundary"},"evidence":["Agent Ops run 31723369081","scheduler-plan-probe artifact 9190251732","readOnly=true; transportSideEffects=false; semanticAuthority=false"],"evidencePath":"ops/evidence/capability-gates/scheduler-supervisor/pass-transport-boundary-1524a11c43f0f024.json"}