{"schemaVersion":"CapabilityGateTransitionEvidence 0.1","capability":"continuation-state","action":"pass","planHash":"fd789b1301764240a5c0f0098fa14a26200a89a0e153fd06bd57b282a6cb8a27","beforeStateHash":"34a99630adfab76a2d58beeb3b0aabd4c141294a0e4ea86c0b9a8f9c9d4d1db0","afterStateHash":"1ea703f8b93ea8fa7a48fa9aeeae7508b531fcc5120b53fe6570d9d5c56f3746","details":{"gateId":"global-authority"},"evidence":["Agent Ops run 31721541661","continuation-authority-probe artifact 9189527873","authority branch coordination/continuations"],"evidencePath":"ops/evidence/capability-gates/continuation-state/pass-global-authority-fd789b1301764240.json"}
