{"schemaVersion":"CapabilityGateTransitionEvidence 0.1","capability":"scheduler-supervisor","action":"pass","planHash":"5a4c832fa57ac7beab12f53f0bf03dd8792ec3b2be5e95ae63847620743c83b2","beforeStateHash":"ba36772de31ea8d2b4c2e7b6af1712f509334435a5dd327b9a77ca9798d97c82","afterStateHash":"a6031205c323b4cb36226ec70507931acd362df55814290ad607fed77af0a401","details":{"gateId":"inspection-integrity"},"evidence":["Agent Ops run 31723369081","tools/tests/test_scheduler_plan.py::test_rejects_tampered_inspection","scheduler-plan-probe artifact 9190251732"],"evidencePath":"ops/evidence/capability-gates/scheduler-supervisor/pass-inspection-integrity-5a4c832fa57ac7be.json"}
