{"schemaVersion":"CapabilityGateTransitionEvidence 0.1","capability":"scheduler-supervisor","action":"promote","planHash":"ae224be521e422a417a50b6fddf4c6e28a5da1974ad09b6ccd915fc426384f98","beforeStateHash":"6ab47b7618154cbdbf11f3d1ea20c14a1042f714572e415e8afc3d761749109a","afterStateHash":"66c11e3bbedab9ced69be8cf360992fac08c7d30fab9daa291b8f3b8df302b60","details":{},"evidence":["all five Scheduler Supervisor Gates passed","Agent Ops run 31723369081","explicit GitOps promotion review"],"evidencePath":"ops/evidence/capability-gates/scheduler-supervisor/promote-promote-ae224be521e422a4.json"}