{"schemaVersion":"CapabilityGateTransitionEvidence 0.1","capability":"scheduler-supervisor","action":"pass","planHash":"0bb8c34f23aafc3ad1a11c07709ec9257294123818b4fcb3a661adf3f22f0b24","beforeStateHash":"a6031205c323b4cb36226ec70507931acd362df55814290ad607fed77af0a401","afterStateHash":"f189206fcfbd6bf52d687e4ae391c544aec4c971c19b0f7547451de697da5255","details":{"gateId":"non-actionable-no-wake"},"evidence":["Agent Ops run 31723369081","tools/tests/test_scheduler_plan.py::test_non_actionable_routing"],"evidencePath":"ops/evidence/capability-gates/scheduler-supervisor/pass-non-actionable-no-wake-0bb8c34f23aafc3a.json"}
