{"schemaVersion":"CapabilityGateTransitionEvidence 0.1","capability":"scheduler-supervisor","action":"pass","planHash":"94fe1bd42a3836b445df8e2d5447146d2a044334fdd3ca30bd3faab78135a7dc","beforeStateHash":"a0cb779ace6ef29b1d32e9601b8db6cdbab1ff303b072cca5df6c08f6e3215a8","afterStateHash":"c227810119f357abe5768cae2bd80b531489861465651616176b85ac80d6b519","details":{"gateId":"routing-contract"},"evidence":["Agent Ops run 31723369081","tools/tests/test_scheduler_plan.py routing tests","scheduler-plan-probe artifact 9190251732"],"evidencePath":"ops/evidence/capability-gates/scheduler-supervisor/pass-routing-contract-94fe1bd42a3836b4.json"}