{"schemaVersion":"CapabilityGateTransitionEvidence 0.1","capability":"scheduler-supervisor","action":"pass","planHash":"17a71865148641bfcdf33900912c27eb6d3b3ff6cb0cee00f9b6202cb610545f","beforeStateHash":"8f9397691b193d029a495ed4da82eda7dce8e5011a235bfe825fd3140f3f525b","afterStateHash":"5cd7caec058ba537ec8b69d3aad6991adbd251a90f7d7d53540ed03370c61c14","details":{"gateId":"routing-contract"},"evidence":["Agent Ops run 31723369081","tools/tests/test_scheduler_plan.py routing tests","scheduler-plan-probe artifact 9190251732"],"evidencePath":"ops/evidence/capability-gates/scheduler-supervisor/pass-routing-contract-17a71865148641bf.json"}