{"schemaVersion":"CapabilityGateTransitionEvidence 0.1","capability":"continuation-state","action":"pass","planHash":"8d9717aa1ab5399d600b8615efeaef3437e82f3cdcc23ec85235b100374d4d75","beforeStateHash":"f628a1cb2c3df6c7b7bf358568ce051a49dc7da59e0d4cfd025db381f0955cce","afterStateHash":"34a99630adfab76a2d58beeb3b0aabd4c141294a0e4ea86c0b9a8f9c9d4d1db0","details":{"gateId":"cas-mutation"},"evidence":["Agent Ops run 31721541661","continuation-authority-probe artifact 9189527873","stale rejection CONTINUATION_PLAN_STALE"],"evidencePath":"ops/evidence/capability-gates/continuation-state/pass-cas-mutation-8d9717aa1ab5399d.json"}
