{"schemaVersion":"CapabilityGateTransitionEvidence 0.1","capability":"scheduler-supervisor","action":"gate-add","planHash":"257fa4048228fc5672d70ccfe7dc1c0c760501d64efeb81868020adb98f17db0","beforeStateHash":"c0535f1016c97479ab51408cc016fa72b0f462e15543398f00ed6037d92d88b4","afterStateHash":"ba36772de31ea8d2b4c2e7b6af1712f509334435a5dd327b9a77ca9798d97c82","details":{"gate":{"id":"rollback","test":"prove canonical GitOps, Maintenance Inspect and Continuation State remain operational when Scheduler planner modules are absent"}},"evidence":[],"evidencePath":"ops/evidence/capability-gates/scheduler-supervisor/gate-add-rollback-257fa4048228fc56.json"}
