{"schemaVersion":"CapabilityGateTransitionEvidence 0.1","capability":"scheduler-supervisor","action":"init","planHash":"483074e9b1d9573b2fc4553fe7d2f2531c5646511566db8104b787540b6084a3","beforeStateHash":null,"afterStateHash":"c0535f1016c97479ab51408cc016fa72b0f462e15543398f00ed6037d92d88b4","details":{"gates":[{"id":"inspection-integrity","test":"prove scheduler rejects tampered or unsupported MaintenanceInspection and binds its plan to inspectionHash"},{"id":"non-actionable-no-wake","test":"prove PAUSE produces no wake and NEEDS_HUMAN routes only to human while RECONCILE routes only to GitOps supervisor"},{"id":"routing-contract","test":"prove HANDOFF routes only to explicit handoffTo and continuation CONTINUE routes only to explicit actor; generic CONTINUE stays with supervisor for assignment"},{"id":"transport-boundary","test":"prove Scheduler v0 planner has no Gmail, Automation, timer or worker-send side effect and only emits a read-only deterministic plan"}],"maxRoundsWithoutActiveGates":3,"deferReason":null},"evidence":[],"evidencePath":"ops/evidence/capability-gates/scheduler-supervisor/init-init-483074e9b1d9573b.json"}
