{"schemaVersion":"CapabilityGateTransitionEvidence 0.1","capability":"continuation-state","action":"init","planHash":"048d167747f369964b759cba021f6ca1bfea2cdac1534ac088862ae1dedbefd5","beforeStateHash":null,"afterStateHash":"f628a1cb2c3df6c7b7bf358568ce051a49dc7da59e0d4cfd025db381f0955cce","details":{"gates":[{"id":"cas-mutation","test":"prove stale/concurrent continuation transition cannot overwrite authority and readback matches applied state"},{"id":"global-authority","test":"prove live continuation state is stored on and observable from a dedicated Git authority independent of worker checkout"},{"id":"maintenance-handoff","test":"prove Maintenance Inspect emits HANDOFF only from explicit remote continuation state and emits no phantom handoff when authority is empty"},{"id":"rollback","test":"prove canonical GitOps and Maintenance Inspect remain operational when Continuation State capability is disabled/unavailable"}],"maxRoundsWithoutActiveGates":3,"deferReason":null},"evidence":[],"evidencePath":"ops/evidence/capability-gates/continuation-state/init-init-048d167747f36996.json"}