{
  "schemaVersion": "CapabilityGateTransitionEvidence 0.1",
  "capability": "peer-recovery",
  "action": "pass",
  "planHash": "866cb538a9ebeae8c4607407df8945706f9125b7a04f316c077dd4e8a213fd1f",
  "beforeStateHash": "75bd9656d71f01e278a47c56f990501c2cab93c63d516ad9f0271000c414218c",
  "afterStateHash": "814d3da4405891512088b9fa203ddd3d8bc12dd936d40a686c69e542c3359bdb",
  "details": {
    "gateId": "b-artifact-materialization"
  },
  "evidence": [
    "https://github.com/EAKerber/MobiliPresenter/actions/runs/32248216962#job-96053282552:test_concrete_b_artifact_materialization_case@d7489342b1c242ada94295aec9725c5b1defd92e"
  ],
  "evidencePath": "ops/evidence/capability-gates/peer-recovery/pass-b-artifact-materialization-866cb538a9ebeae8.json"
}
