{"schemaVersion":"CapabilityGateTransitionEvidence 0.1","capability":"continuation-state","action":"promote","planHash":"b477b319f9fd50d0f122987811415f7fdc694fe3521d969ab914da8e0f4f8825","beforeStateHash":"b27f1bf061e96fbc984754693ccb517ddb118b677499461c68e0e994feae8cfb","afterStateHash":"e77c92746535f5084d047174e540bfad1a3c860e014b47cc60bbae0b814d9a50","details":{},"evidence":["all four Continuation State Gates passed","Agent Ops run 31721541661","explicit GitOps promotion review"],"evidencePath":"ops/evidence/capability-gates/continuation-state/promote-promote-b477b319f9fd50d0.json"}
